{
  "page_type": "weekly-status",
  "metadata_key": "weekly-status-20260801",
  "owner": "Project lead",
  "status": "active",
  "created": "2026-08-01",
  "last_reviewed": "2026-08-01",
  "review_due": "2026-08-08",
  "jira_project": "AIPLATFORM",
  "related_epics": [
    "AIPLATFORM-100"
  ],
  "related_stories": [
    "AIPLATFORM-101"
  ],
  "deliverable_id": null,
  "confidentiality": "internal",
  "managed_by": "jiraman",
  "ownership": "jiraman-managed"
}
